location	lat	lon	txt	place
31.77765,35.23547	31.77765	35.23547	בקידוש שאומרים: ''סברי מרנן'' ואז המסובין עונה ''לחיים'' פירושו הוא:שבתקופת בית המקדש ששפטו אנשים מרנן=החכמים סברי=סברו החכמים סברו שיש לשפוט אותו לכף הטובה כף החיים ולא לכף הרעה כף המוותאני חדש פה אז נעים להכיר :)	בית המקדש
31.258888888,34.797777777	31.258888888	34.797777777	הסתערות הפרשים האחרונה בהיסטוריה (יש עדיין פרשים אבל אני מתכוון יחידת CAVALRY) הייתה במלחמת העולם הראשונה.. בבאר שבע (עד היום יש שחזורים של זה שם)	באר שבע
32.06733889,34.77127778	32.06733889	34.77127778	בסוף הסרט הישראלי "תעלת בלאומליך" (*אזהרת ספילר*) של אפרים קישון מוצף כל רחוב אלנבי ומוכרז כ"ונציה של המזרח התיכון" מן הסתם, ההפקה לא יכלה להציף את רחוב אלנבי האמית ולכן י צר קישון באולפן העתק מדויק בגודל טבעי של כיכר מוגרבי וחלק מהרחוב ואותו הוא בעצם הציף , את התוצאה תוכלו לראות בסרט ותודו שזה נראה אמיתי...	רחוב אלנבי
31.071944444,35.396944444	31.071944444	35.396944444	הצייר האנגלי המפורסם ויליאם הולמן האנט דבק בסגנון ציור ריאליסטי, הדוגל בהצגת החיים כפי שהם. דוגמה לכך היא סיפור הציור "השעיר המשתלח לעזאזל". האנט ביקש להציג את השעיר לעזאזל, על פי ספר שמות וישעיהו, ולשם כך החליט להשתמש בעז אמיתית כמודל לציורו ולציירה על רקע הנוף המתאים לתיאור התנ"כי. לשם כך לקח עז אל הר סדום והציבה על רקע הרי אדום. כדי להשלים את הריאליזם הביא האנט את העז למצב של התייבשות תחת השמש הקופחת בטרם החל לציירה. הדבר עלה בחייה של העז בטרם הושלם הציור, אך האנט לא אמר נואש, חזר לירושלים וקנה עז נוספת. תהליך זה חזר על עצמו פעמיים נוספות בטרם הצליח האנט להשלים את ציורו.	הר סדום
31.95,34.8	31.95	34.8	יש רחוב בראשון לציון בשם המסיכה	ראשון לציון
32.033333333,34.85	32.033333333	34.85	יש כיכר בשם "כיכר אחד עשרה בסמפטמבר" באור יהודה. כמו כן, יש רחוב השכל בתל אביב.	אור יהודה
32.702102777,35.29785	32.702102777	35.29785	עובדה סופר לא חושבה חשבתם מה המפעלים הגדולים עושים עם כול מה שלא עובר בתו תקן? אז המפעל של עלית (שטראוס) שנמצה בנצרת עילית משתמש בכול המוצרים שהוא מייצר אך הם לא עוברים את התקן לתוך קופא ענקית ואז מוכר את זה בקילוגרמים למקומות שבהם מגדלים חיות למאכל כדי שהחיות יוכלו את זה (כן אז הפרא שאנחנו אוכלים סביר להניח שהיא אחלה איזה טעמי טוב או משהוא כזה) מקור- חוזרתי מהרצאה במפעל שלהם	נצרת
32.097991,34.793787	32.097991	34.793787	הלחן של השיר "סימן שאתה צעיר" שמוכר לכולנו משלישיית גשר הירקון והדודאים וגידי גוב וכו'... הוא בכלל לחן לשיר אירי שנקרא "whiskey in the jar" (ויסקי בצנצנת/בחבית). מקור: תבדקו ביוטיוב חחחח...	גשר הירקון
32.054444444,34.751666666	32.054444444	34.751666666	ירושלים היא עיר נורא אירונית: לרחוב הראשי בעיר קוראים בכלל יפו,ובמרכז העיר יש רחובות מרכזיים כמו חברון ובית לחם. ואחד הרחובות הראשיים ברחביה הוא רחוב עזה(עוד יותר אירוני שזה ממש ליד מעון ראש הממשלה) מקור-אני ירושלמי(תכלס אני ממבשרת אבל לא נורא)	יפו
32.421944444,35.528333333	32.421944444	35.528333333	בשנת 1942, ב-22 ביוני, נמדדה הטמפרטורה הגבוהה ביותר שהייתה באסיה עד היום- 54.3 מעלות. נתון זה הוא גם שיא ישראלי כי המקום שבו נמדדה טמפרטורה זו היה קיבוץ טירת צבי. מקור: ויקיפדיה.	טירת צבי
32.016666666,34.766666666	32.016666666	34.766666666	עובדות לא חשובות על ערים ושמות: -אם נתרגם את שם היישוב בית אריה לערבית נקבל (בשינוי קל) את השם דיר אל אסד, שם של יישוב אחר בגליל. אותו דבר עם ראש העין וראס אל עין (כפר בדואי בגליל). מקור שמן של רמלה וחולון זהה ומבוסס על החולות שעליהן הוקמו היישובים -לוד וצפת הן הערים היחידות שהשם שלהן נאמר בהברה אחת. -סנסנה, ספסופה, סאסא, בית זיד, בית עריף ואלקוש הם יישובים יהודיים. מזרעה, בית זרזיר,סולם ורמה הם יישובים ערביים. -אריאל היא מילה נרדפת לירושלים. אחד השמות שהוצעו לעיר תל אביב היה הרצליה. -רימונים גזר ותפוח הינם שמות של יישובים. -בתנ"ך מוזכר מקום בשם "כרמל" (בו היה חי נבל הכרמלי, דמות שעשתה צרות לדוד המלך) אך אין מדובר בהר כרמל אלא ביישוב שהיה באזור הר חברון, ובימינו יש שם התנחלות וכפר ערבי בעלי שם זה. גם חולון לקחה את השם שלה מכפר יהודי שהיה באזור חברון. עוד שמות של יישובים זהים שרחוקים גאוגרפית אחד מהשני: גת וג'ת הגלילית, חצור אשדוד וחצור הגלילית, ובית לחם עם בית לחם הגלילית- כשהדמיון בין השמות גרם לכך שיחשבו שישו נולד בבית לחם שליד ירושלים, כמו דוד המלך ולכן ניתן היה לקשרו לדמות של משיח למרות שהוא נולד בבית לחם שבגליל.	חולון
32.155555555,34.842222222	32.155555555	34.842222222	עובדות לא חשובות על ערים ושמות: -אם נתרגם את שם היישוב בית אריה לערבית נקבל (בשינוי קל) את השם דיר אל אסד, שם של יישוב אחר בגליל. אותו דבר עם ראש העין וראס אל עין (כפר בדואי בגליל). מקור שמן של רמלה וחולון זהה ומבוסס על החולות שעליהן הוקמו היישובים -לוד וצפת הן הערים היחידות שהשם שלהן נאמר בהברה אחת. -סנסנה, ספסופה, סאסא, בית זיד, בית עריף ואלקוש הם יישובים יהודיים. מזרעה, בית זרזיר,סולם ורמה הם יישובים ערביים. -אריאל היא מילה נרדפת לירושלים. אחד השמות שהוצעו לעיר תל אביב היה הרצליה. -רימונים גזר ותפוח הינם שמות של יישובים. -בתנ"ך מוזכר מקום בשם "כרמל" (בו היה חי נבל הכרמלי, דמות שעשתה צרות לדוד המלך) אך אין מדובר בהר כרמל אלא ביישוב שהיה באזור הר חברון, ובימינו יש שם התנחלות וכפר ערבי בעלי שם זה. גם חולון לקחה את השם שלה מכפר יהודי שהיה באזור חברון. עוד שמות של יישובים זהים שרחוקים גאוגרפית אחד מהשני: גת וג'ת הגלילית, חצור אשדוד וחצור הגלילית, ובית לחם עם בית לחם הגלילית- כשהדמיון בין השמות גרם לכך שיחשבו שישו נולד בבית לחם שליד ירושלים, כמו דוד המלך ולכן ניתן היה לקשרו לדמות של משיח למרות שהוא נולד בבית לחם שבגליל.	הרצליה
31.431666666,35.183611111	31.431666666	35.183611111	עובדות לא חשובות על ערים ושמות: -אם נתרגם את שם היישוב בית אריה לערבית נקבל (בשינוי קל) את השם דיר אל אסד, שם של יישוב אחר בגליל. אותו דבר עם ראש העין וראס אל עין (כפר בדואי בגליל). מקור שמן של רמלה וחולון זהה ומבוסס על החולות שעליהן הוקמו היישובים -לוד וצפת הן הערים היחידות שהשם שלהן נאמר בהברה אחת. -סנסנה, ספסופה, סאסא, בית זיד, בית עריף ואלקוש הם יישובים יהודיים. מזרעה, בית זרזיר,סולם ורמה הם יישובים ערביים. -אריאל היא מילה נרדפת לירושלים. אחד השמות שהוצעו לעיר תל אביב היה הרצליה. -רימונים גזר ותפוח הינם שמות של יישובים. -בתנ"ך מוזכר מקום בשם "כרמל" (בו היה חי נבל הכרמלי, דמות שעשתה צרות לדוד המלך) אך אין מדובר בהר כרמל אלא ביישוב שהיה באזור הר חברון, ובימינו יש שם התנחלות וכפר ערבי בעלי שם זה. גם חולון לקחה את השם שלה מכפר יהודי שהיה באזור חברון. עוד שמות של יישובים זהים שרחוקים גאוגרפית אחד מהשני: גת וג'ת הגלילית, חצור אשדוד וחצור הגלילית, ובית לחם עם בית לחם הגלילית- כשהדמיון בין השמות גרם לכך שיחשבו שישו נולד בבית לחם שליד ירושלים, כמו דוד המלך ולכן ניתן היה לקשרו לדמות של משיח למרות שהוא נולד בבית לחם שבגליל.	כרמל
32.72986944,35.04972778	32.72986944	35.04972778	הרכב הישראלי הראשון -סוסותיא. עד 1981 פעלה בישראל חברת "אוטוקראס". הרכב הראשון אשר יוצר במפעל - סוסיתא. כמובן שייצרו עוד דגמים כגון הסברה, רום כרמל,גלבוע, ויוצרו רכבים מייצרניות אחרות - כגון האסקורט הראשונה של פורד. בשנות ה70 האינפלציה הגבוהה בישראל והמיתון הקשה הביאו לסגירת המפעל, ונפילת תעשיית הרכב הישראלית.	רום כרמל
32.868333333,35.211388888	32.868333333	35.211388888	בצרה, כאבול, משהד הן לא רק ערים גדולות בעיראק, אפגניסטן ואיראן (בהתאמה) הן גם שמות של יישובים בארץ ישראל. (בהמשך לדיון על קריית מלאכי-לוס אנג'לס ומי עמי-מיאמי)	כאבול
32.075631,34.770033	32.075631	34.770033	לאור מותו של גדול אומני ישראל,מספר עובדות על אריק איינשטיין: 1)היה בצעירותו אלוף ישראל בהדיפת כדור ברזל ובקפיצה לגובה 2)סרטו הידוע "סאלח שבתי" היה הסרט הישראלי הראשון שהיה מועמד לאוסקר 3)הוא הקליט 550 שירים בקריירה-40 אלבומי סולו(לא כולל כל שיתופי הפעולה הרבים שלו) 4)היה בן יחיד 5)הוא נקבר עכשיו בבית הקברות טרומפלדור,ליד גדולי התרבות הלאומית כמו אחד העם, נחום גוטמן, שאול טשרניחובסקי וחיים נחמן ביאליק...בהחלט מתאים 6)יהי זכרו ברוך מקור:ויקיפדיה	בית הקברות טרומפלדור
31.588611111,34.558333333	31.588611111	34.558333333	השפם הארוך בישראל היה של יונה כץ שכיום מתגורר ביד מרדכי, 67 ס"מ מקור-http://merkazherzog.org.il/content/11 הגעתי לאתר הזה: www.kibbutz.org.il/itonut/2003/haver/030212.yona.htmשהוביל אותי לבסוף לויקיפדיה http://he.wikipedia.org/wiki/%D7%A1%D7%A4%D7%A8_%D7%94%D7%A9%D7%99%D7%90%D7%99%D7%9D_%D7%A9%D7%9C_%D7%92%D7%99%D7%A0%D7A1https://www.google.co.il/search…	יד מרדכי
30.925,34.98111111	30.925	34.98111111	כמה עובדות על מצפה רמון (כי הכי טוב בבית) 😀 1. במצפה רמון קיים מצפה הכוכבים הגדול מסוגו בארץ 2. מצפה רמון נמצאת על שפת מכתש רמון שהוא המכתש הגדול מסוגו בעולם 3.במצפה רמון קיימת חוות אלפקות מהגדולות מסוגה בעולם ולסיום קחו תמונה של יעלים מסתובבים בעיר 😉	המכתש הגדול
31.755666666,35.234416666	31.755666666	35.234416666	הטיילת בירושלים המוכרת בשם "טיילת ארמון הנציב" מורכבת בעצם משלוש טיילות שונות. בשמן ובאופיין. טיילת שרובר. (בתוכה קטע הנקרא "טיילת טרוטנר" ) טיילת האז. טיילת גולדמן.מקור: ויקיפדיה + היכרות אישית עם האיזור.	טיילת ארמון הנציב
32.016666666,34.766666666	32.016666666	34.766666666	כיכר הדמעות בחולון הידועה גם בשמות כיכר קוגל וכיכר הלוחמים, היא אחת הכיכרות המסוכנות בישראל ומתרחשות בה לפחות חמש תאונות דרכים, חלקן קשות, בשנה. מי שאחראי לכיכר המיפלצתית והזוועתית הזו הוא ראש העיר המיתולוגי של חולון פנחס אילון. העירייה אגב מסרבת בתוקף לשנות את הכיכר בעלת שלושת הנתיבים המסוכנים בטענה המטומטמת כי הכיכר היא ״סמלה של העיר״.http://www.nrg.co.il/online/54/ART2/231/286.html	חולון
29.55,34.95	29.55	34.95	כמה עובדות בנושא גיאוגרפיה של ארץ ישראל: 1. הכביש הארוך ביותר בישראל הוא כביש 90, המתחיל במעבר טאבה, אי שם ליד אילת, חוצה את הארץ לאורך כל גבולה המזרחי ומסתיים במעבר "הגדר הטובה" (שכבר לא פעיל 14 שנה), אי שם ליד מטולה. אורכו 478.7 ק"מ. 2. הכביש השני באורכו בישראל הוא כביש 40, המתחיל בצומת קטורה בערבה, עובר דרך כל הנגב, השפלה והמרכז ומסתיים בכפר סבא. אורכו 302 ק"מ3. העיר הגדולה ביותר בישראל באוכלוסייתה ובשטחה היא ירושלים עם 815,300 נפש ו-125,000 דונם. 4. העיר השנייה באוכלוסייתה - תל אביב-יפו (414,500 נפש), והעיר השניה בשטחה - באר שבע (117,500 דונם). 5. העיר הצפופה ביותר בישראל היא בני ברק, עם 22,984 נפש לקמ"ר (פי 2 יותר מניו יורק!). שניה לה היא העיר גבעתיים עם 17,161 נפש לקמ"ר. לשם השוואה, הצפיפות בתל אביב עומדת על 8,005 נפש לקמ"ר (מקום 13 בדירוג הצפיפות בישראל).	אילת
32.185783333,34.907683333	32.185783333	34.907683333	כמה עובדות בנושא גיאוגרפיה של ארץ ישראל: 1. הכביש הארוך ביותר בישראל הוא כביש 90, המתחיל במעבר טאבה, אי שם ליד אילת, חוצה את הארץ לאורך כל גבולה המזרחי ומסתיים במעבר "הגדר הטובה" (שכבר לא פעיל 14 שנה), אי שם ליד מטולה. אורכו 478.7 ק"מ. 2. הכביש השני באורכו בישראל הוא כביש 40, המתחיל בצומת קטורה בערבה, עובר דרך כל הנגב, השפלה והמרכז ומסתיים בכפר סבא. אורכו 302 ק"מ3. העיר הגדולה ביותר בישראל באוכלוסייתה ובשטחה היא ירושלים עם 815,300 נפש ו-125,000 דונם. 4. העיר השנייה באוכלוסייתה - תל אביב-יפו (414,500 נפש), והעיר השניה בשטחה - באר שבע (117,500 דונם). 5. העיר הצפופה ביותר בישראל היא בני ברק, עם 22,984 נפש לקמ"ר (פי 2 יותר מניו יורק!). שניה לה היא העיר גבעתיים עם 17,161 נפש לקמ"ר. לשם השוואה, הצפיפות בתל אביב עומדת על 8,005 נפש לקמ"ר (מקום 13 בדירוג הצפיפות בישראל).	כפר סבא
31.258888888,34.797777777	31.258888888	34.797777777	כמה עובדות בנושא גיאוגרפיה של ארץ ישראל: 1. הכביש הארוך ביותר בישראל הוא כביש 90, המתחיל במעבר טאבה, אי שם ליד אילת, חוצה את הארץ לאורך כל גבולה המזרחי ומסתיים במעבר "הגדר הטובה" (שכבר לא פעיל 14 שנה), אי שם ליד מטולה. אורכו 478.7 ק"מ. 2. הכביש השני באורכו בישראל הוא כביש 40, המתחיל בצומת קטורה בערבה, עובר דרך כל הנגב, השפלה והמרכז ומסתיים בכפר סבא. אורכו 302 ק"מ3. העיר הגדולה ביותר בישראל באוכלוסייתה ובשטחה היא ירושלים עם 815,300 נפש ו-125,000 דונם. 4. העיר השנייה באוכלוסייתה - תל אביב-יפו (414,500 נפש), והעיר השניה בשטחה - באר שבע (117,500 דונם). 5. העיר הצפופה ביותר בישראל היא בני ברק, עם 22,984 נפש לקמ"ר (פי 2 יותר מניו יורק!). שניה לה היא העיר גבעתיים עם 17,161 נפש לקמ"ר. לשם השוואה, הצפיפות בתל אביב עומדת על 8,005 נפש לקמ"ר (מקום 13 בדירוג הצפיפות בישראל).	באר שבע
32.489347222,35.107875	32.489347222	35.107875	השטויות שמאכילים אתכם בסדרות רפואיות - חלק א׳: החולה מתמוטט, קו ישר על מסך המוניטור, והרופאים מתנפלים עליו עם שוק חשמלי (דפיברילטור) שעושה ״בום״ מחריש אוזניים. האמת: מכשיר הדפיברילטור משתק את הפעילות החשמלית של הלב, במטרה שהקצב התקין (קצב סינוס) יתעורר לחיים ויחזור לשלוט בפעימות הלב. כשיש דום לב, לא נותנים שוק חשמלי, זה רק ימית את החולה. הטיפול הוא כמובן - עיסויי לב, הנשמה ותרופות החייאה כמו אדרנלין. אהה כן: השוק החשמלי כלל לא עושה רעש ולא בום. (מקור: בי״ס לרפואה. וכל פרוטוקול החייאה שתרצו)	חריש
32.1952,34.8068	32.1952	34.8068	להתפלל לקדושים הנוצרים זה לא דבר פשוט - יש להם מומחיות. לקראת סוף ימי הביניים הקדושים הפכו לפופולאריים מאוד, מתוך מחשבה שאמנם היו בני תמותה רגילים אך כעת הם יושבים בחצר השמיים ולכן הם נגישים הרבה יותר לאלוהים. אבל זה לא מספיק, יש לפנות לקדוש הנכון: מתיאוס היה פקיד מס, ולכן הוא הפך להיות הקדוש של רואי החשבון. אפולוניה מתה על קידוש האמוהנ הנוצרית מאה ה־3 ובדרך הייסורים שלה עקרו את שיניה, ולכן, מהיותה מומחית לכאבי שיניים, היא הקדושה שכל מי ששיניו כואבות מפנה את תפילותיה אליה. לכל קדוש יש יום משלו בשנה, כמו הקדוש סילבסטר, שחוגג את יומו ב־31.12.	אפולוניה
32.054444444,34.751666666	32.054444444	34.751666666	השם "גוש דן" הוא שם מטעה. הערים יהוד, יפו ובני ברק מוזכרות בתנ"ך כחלק מנחלת אפרים. ובכן, למה בכל זאת נקרא האזור "גוש דן"? פרופ' יואל אליצור מסביר שככל הנראה לשבט דן לא הייתה נחלה. הוא ישב מפוזר בערים מיהודה (צרעה, אשתאול, תמנה ועקרון) ומאפרים (שעלבים, יהוד, בני ברק).מקור: "מקום בפרשה", מאת פרופסור יואל אליצור, עמוד 292	יפו
32.033333333,34.883333333	32.033333333	34.883333333	השם "גוש דן" הוא שם מטעה. הערים יהוד, יפו ובני ברק מוזכרות בתנ"ך כחלק מנחלת אפרים. ובכן, למה בכל זאת נקרא האזור "גוש דן"? פרופ' יואל אליצור מסביר שככל הנראה לשבט דן לא הייתה נחלה. הוא ישב מפוזר בערים מיהודה (צרעה, אשתאול, תמנה ועקרון) ומאפרים (שעלבים, יהוד, בני ברק).מקור: "מקום בפרשה", מאת פרופסור יואל אליצור, עמוד 292	יהוד
31.781097222,35.0101	31.781097222	35.0101	השם "גוש דן" הוא שם מטעה. הערים יהוד, יפו ובני ברק מוזכרות בתנ"ך כחלק מנחלת אפרים. ובכן, למה בכל זאת נקרא האזור "גוש דן"? פרופ' יואל אליצור מסביר שככל הנראה לשבט דן לא הייתה נחלה. הוא ישב מפוזר בערים מיהודה (צרעה, אשתאול, תמנה ועקרון) ומאפרים (שעלבים, יהוד, בני ברק).מקור: "מקום בפרשה", מאת פרופסור יואל אליצור, עמוד 292	אשתאול
32.997888888,35.448938888	32.997888888	35.448938888	אני לא יודע באם הפוסט מתאים ל"עובדות לא חשובות" או "מה הקטע להדליק מדורה ולהיחנק בעשן?".... אבל: בל"ג בעומר נוהגים להדליק מדורות אש. הסיבה למנהג זה אינה לגמרי ברורה אך מייחסים שני הסברים למנהג הדלקת המדורות:1. הסבר המבוסס על הקשר בין מרד בר כוכבא ובין ל"ג בעומר: המורדים הדליקו משואות אש על ראשי ההרים כדי להעביר את ההודעה על פרוץ המרד והמדורות שמדליקים היום בל"ג בעומר הן זכר לאותן משואות.2. על-פי המסופר בספר הזוהר, ביום מותו של רבי שמעון בר יוחאי הוא קרא לחבריו וביקש לגלות להם סודות מתורות הסוד, אך ביתו עלה באש, ולזכרה של האש נהגו להדליק מדורות ביום פטירתו – יום ל"ג בעומר.	בר יוחאי
32.8,34.983333333	32.8	34.983333333	בחיפה נהוג לאחל אחד לשני חג שמח בין התאריכים ה25-31/12, ללא קשר לדת שלך, בגלל הריכוז הגבוה של נוצרים ורוסים.	חיפה
