location	lat	lon	txt	place
32.054444444,34.751666666	32.054444444	34.751666666	כולכם מכירים את הריבה, המילוי הטעים של הסופגניה. זאת אחת המילים שחידש אליעזר בן יהודה למה שנקרא פעם מרקחת פירות. ולמה הוא בחר לקרוא למרקחת פירות ריבה? אליעזר בן יהודה רצה לחדש מילים על סמך המקורות הקדומים שלנו. ובמקרה הזה על סמך סוגיה קטנה בתלמוד הירושלמי. בספר ויקרא כתוב שביום שהכהן מתחיל לעבוד במשכן, הוא צריך להביא קרבן מנחה שזה סוג של עוגת סולת מטוגנת במחבת. וככה כתוב במקרא: עַל-מַחֲבַת, בַּשֶּׁמֶן תֵּעָשֶׂה--מֻרְבֶּכֶת תְּבִיאֶנָּה; תֻּפִינֵי מִנְחַת פִּתִּים, תַּקְרִיב רֵיחַ-נִיחֹחַ לַיהוָה.חכמים נחלקו מה פרוש המילה תופיני: • רבי יסא מפרש: המנחה צריכה להיות חצי מטוגנת וחצי אפויה • רבי אחא: קודם לאפות ואחר כך לטגן. • רבי (רבי יהודה הנשיא): נאה. כנראה שצריך לקשט את המנחה • רבי דוסא: ריבה כשאליעזר בן יהודה קרא את הקטע הזה, הוא הבין שרבי דוסא התכוון למרקחת פירות. כמו מהשורש רב"ב. וכך חודשה בשפה שלנו הריבה.העניין הצחיק מאוד את תלמדי החכמים של אותו הדור משתי סיבות: 1. הקטע בתלמוד הוא עם טעות סופר ובמקור רבי דוסא אמר "רכה" ולא "ריבה" 2. המילה ריבה היתה כבר תפוסה בשפה העברית לתאר נערה צעירה. כמו בסיפור הבא על חטאת אנשי סדום: היתה ריבה אחת, שהיתה מוציאה לחם לעניים בתוך כד. נתגלה הדבר. משחוה בדבש והעמידוה על גג החומה, באו צרעות ואכלוה. וזהו שנאמר: "ויאמר ה' זעקת סדום ועמרה כי רבה". אמר רב יהודה אמר רב: על עיסקי ריבה.ש"י עגנון גם צחק על אליעזר בן יהודה על העניין הזה ובנובלה שלו "שבועת אמונים" הוא סיפר על עולה חדש ממדינת הקיר"ה שבא ליפו והתחבר שם לשבע נערות (ריבות) וכך הוא תאר את הווי השכונה ביפו: "אדם משכים בבוקר ושותה תה ומלפת את פתו בזיתים ובירקות ויוצא לעסקיו ועושה עד לסעודת הצהרים וחוזר לביתו קודם חשיכה ומוצא לפניו מיחם רותח, ושכנים באים זה אצל זה ושותים תה עם מרקחת של פירות, יש שם תלמיד חכם, מתלוצץ הוא על בעל המלון שטעה בפירוש המלות וקרא למרקחת של פירות ריבה". בעל המלון הוא אליעזר בן יהודה. מקורות: פרוש המילה רבה: https://he.wiktionary.org/wiki/%D7%A8%D7%91%D7%94 מאמר שמסביר את הטעות באריכות מרקחת טעות: http://www.tog.org.il/m/Idea.aspx?id=246 ריבה מפרסמת ריבה: https://www.youtube.com/watch?v=qrbAR1yFr3k	יפו
33.0065,35.1246	33.0065	35.1246	מה משותף לקריין החדשות, השופט והרמטכ"ל בתמונות?תשובה- שלושתם קיבלו דרגת ייצוג בצה"ל.מהי דרגת ייצוג? דרגת ייצוג על פי הוראות הפיקוד העליון של צה"ל, היא דרגת קצונה, המוענקת במקרים מיוחדים לחייל לתקופה קבועה מראש והגבוהה מדרגת הקבע שנושא החייל באותה עת.עודד בן עמי, כיום כתב חדשות בערוץ 2 מונה בשנת 1996 לתפקיד דובר צה"ל ועל כן מונה לדרגת תת אלוף כדרגה ייצוגית.השופט עודד מודריק (שבין פסיקותיו הרשעתו של הרוצח יגאל עמיר אבל זה לפעם אחרת), כיום פרופסור בפקולטה למדעי החברה והרוח באונ' אריאל, השתחרר מצה"ל בדרגת אלוף משנה ובמהלך שירות מילואים הועלה לדרגת תת אלוף. מונה לדרגה הגבוהה ביותר בצה"ל - רב אלוף כדי שיוכל לשפוט את הרמטכ"ל, משה יעלון, בגין תאונת דרכים שנגרמה באשמתו ושנגרם בה נזק לרכב הצבאי שלו.והאחרון- הרמטכ"ל רפול ז"ל. אבל רגע, הוא הרי בעל הדרגה הגבוהה ביותר בצה"ל, (ולפי ההגדרה דרגת ייצוג צריכה להיות גבוהה מדרגת הקבע שנושא החייל באותה עת)אז איזו דרגת ייצוג הוא יכול לקבל? (ולמה הוא צריך את זה?)תסתכלו רגע על תמונה שלו, רואים את כנפי הטיסה מעל לכיס ימין? בעבר לבכירי צה"ל הייתה אפשרות לעבור קורס טיס מקוצר למטוסים קלים ונשאו את כנפי בד עם האות "ק" (קישור וסיור). על כן בשנות השישים עבר קורס טיס מקוצר. והחל לצבור שעות טיסה. בתום שנות השבעים, הומרו כנפיים אלה בכנפי טיס רגילות.לאחר סיום כהונתו כרמטכ"ל, התנדב לשירות מילואים כטייס, קיבל דרגת ייצוג של רב-סרן (!) והשתתף במשימות קישור ומודיעין.אציין כי יש עוד אנשים שקיבלו דרגות ייצוג (מתוקף תפקיד, הערכה על תרומתם ועוד) פשוט החלטתי להתמקד בהם.מקורות:דרגות בצה"ל: https://he.m.wikipedia.org/…/%D7%93%D7%A8%D7%92%D7%95%D7%AA…עודד בן עמי: https://he.m.wikipedia.org/…/%D7%A2%D7%95%D7%93%D7%93_%D7%9…עודד מודריק: https://he.m.wikipedia.org/…/%D7%A2%D7%95%D7%93%D7%93_%D7%9…רפאל איתן: https://he.m.wikipedia.org/…/%D7%A8%D7%A4%D7%90%D7%9C_%D7%9…	בן עמי
31.772361,35.2045	31.772361	35.2045	עיצוב לוגו חיינו מוקפים במותגים ומותגי על. אם שאלתם את עצמכם מה המשותף בין החברות הישראליות הבאות: 1. טבע 2. טמבור 3. אל-על 4. ארקיע 5. דלק 6. לילי 7. עיצוב סמלי המכבייה לאורך השנים לבין עיטורי העוז והגבורה, כרזות מפורסמות כמו זו שקראה לשחרר את יהודי ברית המועצות בסיסמא Let my people go ובכן מאחורי כל אלו עומד מעצב אחד דן ריזינגר לאחרונה גם הייתה תערוכה של עיצוביו במוזיאון ישראל.קישורים האתר של דן ריזינגר http://www.danreisinger.com/ כנסו ותלחצו על logosכתבה בעיתון הארץ https://www.haaretz.co.il/…/ar…/.premium-MAGAZINE-1.4216541…הערך על עיטור העוז https://he.wikipedia.org/…/%D7%A2%D7%99%D7%98%D7%95%D7%A8_%…בתמונות כמה מהלוגואים המפורסמים ודן ריזינגר עובדת בונוס בשמות חברות השמות לרוב גם בעברית וגם באנגלית	מוזיאון ישראל
31.75236111,35.182	31.75236111	35.182	המונח האנגלי Double cross בא לתאר בגידה או אי קיום הסכם, הבטחה או עסקה בין 2 צדדים. המונח קיים גם כפועל – to double cross. אך האם אתם יודעים מהו מקורו ? בכל אופן, המונח double cross החל להשתרש עוד במאה ה-18. הוא הופיע במחזה המצליח "האלמנה האירית" מאת דיוויד גריק מאותה תקופה. מעט קודם לכן, המונח cross (לאו דווקא במובנו של צלב אנכי המוכר לנו אלא גם כ- X) החל להשתרש בהקשר לעסקה שנחתמה שלא על בסיס טהור והוגן בין אחד או יותר מהצדדים. עסקה כזו הופיעה לרוב בהקשר ספורטיבי (הטיית תוצאות משחק ע"י בעלי עניין). בניגוד אליה, עסקה שהתקיימה על בסיס רצון אמיתי וכן מצד כל הצדדים סומנה כ square - (ומכאן גם הביטוי ההפוך – fair and square). גם למשמעות המילה double ("כפול"), מספר הקשרים פחות חיוביים. המשמעות השלילית באנגלית נוצרת בגלל הדימוי לאדם השם פעמיו בכיוון אחד אך משנה את דעתו וחוזר אחורה, בדומה לצד המשנה דעתו בעסקה לאחר שנחתמה. בהקשר דומה קיים המושג דו-פרצופיות או צביעות (hypocrisy). מונח זה לקוח מיוונית ומגיע מתחום התיאטרון שבה הדמות למעשה לובשת "פרצוף כפול". נגזרות של המונח קיימות בצורות רבות וגם בעברית: "זאב בעור כבש", "כיפה אדומה" (הלקוח מסיפור ילדים אך נפוץ בעולם התחתון לתיאור מצב שבו שני צדדים באים לבצע עסקה כאשר צד אחד בעצם טומן מלכודת או מארב לצד האחר), סוכן כפול (double agent) כשהכוונה לסוכן שהופך צד או פועל עבור שני צדדים ועוד... ניתן באמת להסיק שהמונח, בדומה להיפוכו, הוא מונח טאוטולוגי (שקיימת בו חזרתיות או יתירות) כלומר כל אחת מצמד המילים מתארת למעשה את אותו דבר בנפרד.עובדת בונוס #1: המודיעין הבריטי הרכיב יחידה במלחה"ע ה 2 שתפקידה לאלץ סוכנים גרמנים להפוך לסוכנים כפולים שיפיצו ידיעות כוזבות בתמורה לחייהם. היחידה שהוקמה לכך נקראה The twenty Committee, וכבר ניתן להבחין שהמספר לא ניתן לה סתם (20 מסומנים כ- XX בספרות רומיות...) עובדת בונוס #2: ניתן לשים לב שבסרטו של צ'רלי צ'פלין ה"דיקטטור הגדול" הוא מגלם את הנשיא הינקל העומד בראש מפלגה שסימונה הוא 2 צלבים (או 2 X-ים), זאת כהתרסה על היטלר ומפלגתו שהפרו לא מעט הסכמים... אגב בסרט מגלם צ'פלין עצמו תפקיד כפול של שתי דמויות השונות לחלוטין אחת מהשנייה.מקורות: https://www.phrases.org.uk/meanings/double-cross.htmlhttp://www.globes.co.il/news/article.aspx?did=864847	מלחה
31.78307778,35.21981944	31.78307778	35.21981944	מאז ימיו של המלך ג'ורג' הראשון ב-1660, כל הצאצאים הזכרים לבית המלוכה הבריטי, עברו ברית מילה.אתם שואלים למה? ובכן, זו שאלה טובה.אחת השמועות אומרת שהמלכה ויקטוריה האמינה שהיא צאצאית לבית דוד המלך (כן, הוא משלנו) ולכן מלה את ילדיה. זה נחמד והכל, אבל הבעיה היא שמלכה ויקטוריה חיה אחרי המלך ג'ורג', אז כפי הנראה זו איננה הסיבה המקורית.האחרון שעבר ברית מילה הוא הנסיך צ'ארלס. הראשונה שהפרה את המנהג היתה הנסיכה דיאנה (אשתו של צ'ארלס) שהתנגדה למול את ילדיה וויליאם והארי.השאלה שנותרה לא פתורה היא האם יורש העצר השלישי במספר - ג'ורג', בנם של וויליאם וקייט, עבר ברית מילה.תייגו מישהו שהוא צאצא לבית מלכות דוד, ואחד שהוא יורש עצר בריטי ותנו להם לערוך קרב רומחים ביניהם.מקור: http://www.jpost.com/…/Will-Kate-and-Will-order-the-Royal-S…	בית דוד
32.054444444,34.751666666	32.054444444	34.751666666	-"מה בריטי בעיניך?" -"עוגות יפו!"כמעט בכל סופרמרקט בבריטניה אפשר למצוא מותג מאוד פופולרי של עוגיות הנקראות Jaffa Cakes. מדובר במעין עוגיות קטנות שמעליהן יש ג'לי בטעם תפוז, וציפוי שוקולד. את העוגיות ייצרה לראשונה חברה בריטית בשם McVitie's, והן כל כך פופולריות, שתושבי הממלכה מחשיבים אותן לסמל בריטי של ממש. קל לנחש את מקור השם של העוגיות - הן נקראות על שם זן התפוזים Jaffa, שבתורו קיבל את שמו מהעיר יפו, בה גודל למטרות ייצוא לראשונה.עובדת בונוס: בשנת 1991 נתבקש בית המשפט להכריע בהחלטה האם Jaffa Cakes הן עוגות או עוגיות לצרכי מע"מ. החברה המייצרת הייתה בעלת אינטרס ברור להחשיב אותן כעוגות, כיוון שאחוז המס על עוגות מצופות שוקולד נמוך מאחוז המס על עוגיות מצופות שוקולד. אחרי בחינה של שורת קריטריונים כמו מרקם, סוג הבלילה, גודל וכו', פסק בית המשפט ש"עוגות יפו" הן אכן עוגות לצרכי מס.מקורות: https://en.m.wikipedia.org/wiki/Jaffa_Cakeshttps://en.m.wikipedia.org/wiki/Jaffa_orange	יפו
33.278888888,35.576666666	33.278888888	35.576666666	במטוס נוסעים מסוג 400-Boeing 747 יש כ274 ק"מ של חוטי חשמל! שזה פחות או יותר שווה ערך לחוט חשמל הנמתח ממטולה בצפון ועד שדה בוקר בנגב.מקורות: http://www.airliners.net/forum/viewtopic.php?t=176707 http://worldofaviation.net/interesting-facts-about-boeing-…/#	מטולה
31.751388888,34.988611111	31.751388888	34.988611111	המקומות המקוללים של ישראלהרבה אנשים נוהגים לקלל, אך לא הרבה נוהגים לתעד את הקללות שלהם. המצרים הקדמונים דווקא תיעדו זאת בטקסטים כתובים שנקראים "כתבי המארות". אלו הם כישופים או קללות שנכתבו במצרים העתיקה על גבי חרסים וצלמיות מהמאה ה-20 לפנה"ס ואילך. ייעודם היה לפגוע בקבוצות אנשים וערים אם יעזו למרוד במצרים. זאת מתוך אמונה כי בעזרתם יוכלו לעצור מרידות עתידיות של הארצות והערים הנשלטות על ידם.המקומות המקוללים בארץ ישראל כמו אשקלון, לכיש, אפק, בית שמש, אשמם (ירושלים), אשאן (בית שאן), עפל (עפולה), מגידו, שכם, ג'נין, עכו, ליש, חצור, אכשף, משאל ורחוב.בצלחת המופיעה בתמונה מקוללת העיר ירושלים וזהו האזכור הקדום ביותר לשם זה.חמסה, חמסה, חמסה, טפו, טפו, טפומקור:http://hebrewarchaeology.blogspot.co.il/…/blog-post_12.html…https://he.m.wikipedia.org/…/%D7%9B%D7%AA%D7%91%D7%99_%D7%9…	בית שמש
31.776667,35.23425	31.776667	35.23425	***עובדה וחצי על דאלי, ציונות ומדינת היהודים***ב1968, במלאת 20 שנה לעצמאותה של מדינת ישראל, פירסם האמן סלבדור דאלי את סדרת יצירותיו "עליה - תקומתה של ישראל" העוסקת בהיסטורית העם היהודי ושובו למולדת. בהתבסס על המאורעות ההיסטוריים, השראה מהתנ"ך ובאמצעות 25 יצירות נועזות אך מרגשות, מציג דאלי ארבעה נושאים מרכזיים: גלות ותקווה, יישוב מחדש, שואה ועצמאות. בין האירועים, הדמויות והמקומות החשובים המוצגים בתערוכה: - הכותל המערבי המציג את זיקת העם היהודי לא"י. - שואת היהודים המוצגת ביצירה "ממעמקים". - אניית המעפילים "אליהו גולומב" המוצגת ביצירה "על חופי החירות". - דיוקנה של רבקה גובר - "אם כל הבנים" המציג את השכול כמחירה הכבד של החירות. - הכרזת העצמאות על ידי דוד בן-גוריון.כאשר נשאל דאלי לפשר זיקתו המסתורית ליהדות ולישראל באומנותו ענה: "לישראל יש אויבים רבים, אבל יש לה גם חברים, ואני אחד מחבריה".התערוכה מוצגת כיום בעיר פיגרס בספרד.אין צורך להרחיק לכת עד ספרד על מנת לראות יצירה ציונית של דאלי. אחת מיצירותיו, פסל "מנורת השלום" שתרומתו ניתנה על ידי פלאטו שרון, מוצגת מחוץ לטרמינל 3 בנמל התעופה בן גוריון.חג עצמאות שמח!מקורות: http://www.js.emory.edu/BLUMEN…/Salvador%20Dali%20Aliyah.htm https://www.globes.co.il/news/docview.aspx?did=1001104791 https://www.salvador-dali.org/…/artwo…/exhibitions/45/aliyah	הכותל המערבי
32.496111111,35.498888888	32.496111111	35.498888888	מכירים את זה שאין לכם תופים אז משתמשים בכיסא? זה בדיוק מה שקרה בשיר "חתול מפלצת" של פורטיס, ה"תופים" הם בעצם כיסא עליו תופף ז'אן ז'אק גולדברג. הסיבה היתה מחאה על כך שכל שאר התופים באלבום בוצעו במכונת תופים. יש עוד דוגמאות לכלים מאולתרים: 1. בשיר "אני הולך לבית שאן" הסולו בנג'ו הוא למעשה סולו גיטרה עליה הודבק סלוטייפ כדי לדמות את הצליל של הבנג'ו (לגרי אקשטיין לא היה בנג'ו בשביל ההקלטה). 2. בשיר "It's Probably Me" של סטינג המקצב הוא סימפול של מצית זיפו (בהשראת הסיגריות הרבות שהדליק אריק קלפטון, שמנגן כאן גיטרה). 3. וכמובן, כל הכלים ב"Don't worry Be Happy" של בובי מקפרין בוקעים מפיו המוכשר במיוחד.#עלחמוזיקה מקורות: 1. http://he.wikipedia.org/wiki/סיפורים_מהקופסא 2. לא מוצא את קישור עם הסיפור הזה אבל אימתתי אותו ישירות מול גרי בעצמו לפני כמה שנים. 3. גם כאן במפתיע לא מצאתי אימות לסיפור הזה אבל נשמע שהוא נכון (זה באמת נשמע כמו זיפו, אולי זה לא בהשראת קלפטון, אבל זיפו). 4. http://en.wikipedia.org/wiki/Don't_Worry,_Be_Happy	בית שאן
31.774166666,35.175555555	31.774166666	35.175555555	#עלחנשים (למרות שזה מאוד חשוב)נשים ואומץ-אירנה סנדלר, אחות ועובדת סוציאלית פולנייה החליטה לעשות מעשה. כאשר נכנסה לגטו וראתה את הזוועות המתרחשות שם החליטה כי עליה להציל את הילדים ועל כן להוציא אותם אל מחוץ לגטו.באומץ כביר תוך סיכון רב ועינויים מצד הגסטפו- אירנה ושותפיה הוציאו והצילו 2500 ילדים.על מנת לאתר את הילדים בסוף המלחמה אירנה ערכה רישום מדויק של כל הילדים והטמינה בחצרות.כמובן היא הוכרה כחסידת אומות עולם ואף נעשה עליה סרט קולנועי בשם "ליבה האמיץ של אירנה סנדלר", מומלץ לצפייה.אירנה נפטרה בשנת 2008 בגיל 98.סיפור בונוס- כשביקרתי ביד ושם המדריך סיפר לי שלפני כמה שנים באה קבוצת בנות מאולפנה לפולין והן הלכו לפגוש אותה. לפני, הן גייסו כספים כדי לעזור לאירנה בפן הכלכלי. כשהבנות הגיעו לשם, אירנה לקחה את המעטפה עם הכסף וביקשה מהן לבוא איתה.אירנה הלכה עם הבנות ברחובות העיר וחילקה את הכסף לחסרי-בית, עד הפרוטה האחרונה.אצילות נפש.מקורות-https://he.m.wikipedia.org/wiki/אירנה_סנדלר	יד ושם
31.78472222,35.21083333	31.78472222	35.21083333	מואיז הקטן הוא בכלל כדורגלן. פעם תהיתם מי אלה סימון ומואיז הקטן משירו של יוסי בנאי? אלה הם האחים שמעון ומשה יאיר חברי הילדות של בנאי כמובן. השלושה אפילו לא למדו באותו בית-ספר אך היו שלישיית חברי ילדות שגדלו יחד באזור שוק מחנה יהודה. סימון (שמעון יאיר) עבד עד לפני כמה שנים במרכז הדמוגרפי במשרד ראש הממשלה, ומואיז הקטן (משה יאיר) הוא שחקן כדורגל לשעבר ועו"ד במקצועו שמשרדו אגב ממוקם במרחק הליכה מקולנוע רקס שמוזכר גם הוא בשיר עליהם. הם היו ילדים וזה היה מזמן.ראיון עם סימון ומואיז: http://www.news1.co.il/Archive/003-D-92787-00.htmlמקורות נוספים: https://he.m.wikipedia.org/…/%D7%90%D7%A0%D7%99_%D7%95%D7%A…http://www.ravdori.co.il/…/%D7%90%D7%A0%D7%99-%D7%95%D7%A1…/	מחנה יהודה
32.103152777,34.796416666	32.103152777	34.796416666	#על״ח_בניחוח_ספרדיבכל שנה ב-28 בדצמבר מתרחש בעיר הקטנה איבי (Iby) בספרד פסטיבל מיוחד בשם ״ Els Enfarinats״. במהלך האירוע כ-30 תיירים ומקומיים, לבושים בגדי צבא, מביימים הפיכה צבאית. Els Enfarinats (״המקומחים״) משתלטים לכאורה על העיר ומכריזים על מה שהם מגדירים כ״שורה של חוקים חדשים ומגוחכים״ אותם הם אוכפים בחומרה לאורך היום. כנגדם עומדת קבוצה דמוית משטרה, La Oposicio (״האופוזיציה״), שמנסה לשמור על הסדר הקיים. Els Enfarinats אפילו גובים קנסות מאלו שאינם עומדים בחוקים שקבעו (אל דאגה, בסוף היום כל הרווחים מקנסות אלו נתרמים לצדקה). לאורך הפסטיבל המשתתפים (כולם גברים) ממחיזים סצנות המדמות את כיבוש העיר שמסתיים בקרב אדיר בסוף היום החגיגי ובו המשתתפים זורקים זה על זה קמח, ביצים וחזיזים. מדובר במסורת של 200 שנה שחודשה ב-1981 לאחר שיום זה לא צוין זמן ממושך.מקורות: צילומים של האירוע על ידי הצלם האיטלקי Antonio Gibotta (שעוסק בתיעוד פסטיבילים מיוחדים ושונים ברחבי העולם) מוצגים בימים אלה בתערוכה ״עדות מקומית״ של מוזיאון ארץ ישראל בתל אביב (תמונה לדוגמה מצורפת בפוסט) וגם - https://www.nationalgeographic.com/…/you-won_t-believe-thi…/ כתבה על האירוע, מלאה בעוד תמונות מהפיאסטה - https://www.youtube.com/watch?v=GjObCRTgS6I	מוזיאון ארץ ישראל
31.740833333,35.458611111	31.740833333	35.458611111	החלטה של האו"ם על סיום המנדט הבריטי והקמת שתי מדינות עצמאיות בארץ ישראל, היא אומנם מאורע היסטורי חשוב, אך יש עוד אירוע שנשכח קצת והתרחש באותו יום בדיוק, אז היום לפני 70 שנה גם כן, ב-29 בנובמבר 1947, פרופ' אליעזר סוקניק, פילולוג וארכאולוג מהאוניברסיטה העברית, שמע לראשונה מסוחר עתיקות ארמני על התגלית הארכאולוגית של המאה — המגילות הגנוזות מקומראן. ארבע מגילות נרכשו כבר על ידי מאר סמואל, ראש המנזר הסורי אורתודוקסי בירושלים. סוקניק, שעמד על חשיבותה של התגלית, גייס את הכסף שנדרש לרכישת שלוש מגילות נוספות שהתגלו אז — מלחמת בני אור בבני חושך, מגילת ההודיות ומגילת ישעיהו — ואלה היו הבסיס של האוסף שעבורו נבנה היכל הספר. בנו של סוקניק, יגאל ידין, קנה לימים את ארבע המגילות שרכש סמואל וגם ניהל חפירות ארכאולוגיות במערות קומראן.מקור:http://www.zionistarchives.org.il/…/Addit…/Pages/Scroll.aspx	קומראן
