location	lat	lon	txt	place
32.063611111,34.855277777	32.063611111	34.855277777	האם פעם הלכתם למסעדת מזון מהיר ואז גיליתם שכל קשר בינה לבין "מהיר" הוא מקרי בלבד? בשנת 2007 חבורת נערים החליטה "להעניש" את רשת מקדונלד'ס כנקמה על כך שאחד מהחברים חיכה זמן רב באחד מסניפי הרשת עד שקיבל מיץ תפוזים. במשך שנה אספו הנערים מטבעות של 5 ו-10 אגורות בכל פעם שהם קיבלו עודף, ואף ביקשו מהורים וחברים. לבסוף הם הלכו לסניף מקדונלד'ס בלונדון מיניסטור בתל אביב עם תיקים מלאים במטבעות. כאשר הם הגיעו לשם הזמינו אוכל בשווי 600 ש"ח, וכשההזמנה הייתה מוכנה הם הניחו את כל המטבעות על הדלפק. בהתחלה הקופאית חשבה שהם מתלוצצים, אבל לבסוף הבינה שזה רציני וקראה לעובד נוסף שיעזור בספירה. בסופו של דבר לקח להם ארבע שעות לספור את הכסף, כאשר הדבר כמובן גרם לתור ארוך בקופה והקופאית נאלצה להתנצל בפני כל מי שחיכה. אחד הנערים התוודה שזה באמת התחיל כנקמה אך המשיך בשביל הצחוק, ובסופו של דבר הם עשו את זה בעיקר כי היה להם משעמם בקריית אונו.מקור: http://www.ynet.co.il/articles/0,7340,L-3424337,00.htmlהסרטון של המעשה הזה, המכונה "מבצע מיץ תפוזים 5":https://www.youtube.com/watch?v=hL_Rfx5y5RQ**הערה - מכיוון שאני שומר שבת, חשוב לי לציין שלא שלחתי את הפוסט הזה לקבוצה בשבת אלא ביום שישי בצהריים, וכנראה לקח זמן עד שאושר ע"י המנהלים.**	קריית אונו
32.08088333,34.78057222	32.08088333	34.78057222	משנת 1938 ועד 1980, פעל בתל אביב גן החיות הראשון בישראל, במתחם שאנו מכירים היום בשם "גן העיר" מצפון לכיכר רבין. בין 200 בעלי החיים ששהו בגן החיות יכולתם למצוא: נמרים, טיגריס, אריות, דובים, זברות, פלמינגו, צבים ענקיים, פילים, עופות דורסים ועוד.סיפורו של גן החיות מתחיל עם עלייתו ארצה של הרב ד"ר מרדכי שורנשטיין אשר כיהן כרב העיר קופנהגן, אשר היה ידוע בחיבתו המיוחדת לבעלי חיים שונים. בשנת 1935 פתח שורנשטיין ברחוב שינקין 15 בתל אביב חנות בעלי חיים, שבה החזיק למכירה ציפורים ויונקים קטנים. את מירב העניין לכד קוף, שהיה הראשון שראו מרבית מתושבי העיר.בשנת 1936 עזר ראש העיר דאז ישראל רוקח לשורנשטיין לעבור לשטח גדול יותר ברחוב הירקון 65 ואף יזם מעבר של שני גורי אריות שהתקבלו במתנה מגן החיות בקהיר. בהמשך נתרמו גם זוג נמרים. תושבי העיר הרבו להגיע למקום החדש כדי לצפות בחיות, אך במקביל החלו להישמע קולות הטוענים כי חיות הבר מהוות סכנה לציבור. בשנת 1938 הושלמה בניית "גן החיות של תל אביב" בשטח שהיה אז לא מיושב בצפון מזרח העיר. גן החיות פעל למעלה מארבעים שנה.*** עובדת בונוס: מרבית מבעלי החיים בספארי ברמת גן היום, הם הצאצאים של אותם בעלי חיים ששהו בגן החיות הישן בתל אביב.תיעוד וידאו של גן החיות: https://www.youtube.com/watch?v=cR7d9_7yRrgמקור 1: https://he.wikipedia.org/…/%D7%92%D7%9F_%D7%94%D7%97%D7%99%…מקור 2: http://tel-aviv.millenium.org.il/…/9503E939-6A6E-4D3C-978D-…מקור לעובדת בונוס: https://he.wikipedia.org/…/%D7%94%D7%A1%D7%A4%D7%90%D7%A8%D…	כיכר רבין
32.0825,34.7805	32.0825	34.7805	משנת 1938 ועד 1980, פעל בתל אביב גן החיות הראשון בישראל, במתחם שאנו מכירים היום בשם "גן העיר" מצפון לכיכר רבין. בין 200 בעלי החיים ששהו בגן החיות יכולתם למצוא: נמרים, טיגריס, אריות, דובים, זברות, פלמינגו, צבים ענקיים, פילים, עופות דורסים ועוד.סיפורו של גן החיות מתחיל עם עלייתו ארצה של הרב ד"ר מרדכי שורנשטיין אשר כיהן כרב העיר קופנהגן, אשר היה ידוע בחיבתו המיוחדת לבעלי חיים שונים. בשנת 1935 פתח שורנשטיין ברחוב שינקין 15 בתל אביב חנות בעלי חיים, שבה החזיק למכירה ציפורים ויונקים קטנים. את מירב העניין לכד קוף, שהיה הראשון שראו מרבית מתושבי העיר.בשנת 1936 עזר ראש העיר דאז ישראל רוקח לשורנשטיין לעבור לשטח גדול יותר ברחוב הירקון 65 ואף יזם מעבר של שני גורי אריות שהתקבלו במתנה מגן החיות בקהיר. בהמשך נתרמו גם זוג נמרים. תושבי העיר הרבו להגיע למקום החדש כדי לצפות בחיות, אך במקביל החלו להישמע קולות הטוענים כי חיות הבר מהוות סכנה לציבור. בשנת 1938 הושלמה בניית "גן החיות של תל אביב" בשטח שהיה אז לא מיושב בצפון מזרח העיר. גן החיות פעל למעלה מארבעים שנה.*** עובדת בונוס: מרבית מבעלי החיים בספארי ברמת גן היום, הם הצאצאים של אותם בעלי חיים ששהו בגן החיות הישן בתל אביב.תיעוד וידאו של גן החיות: https://www.youtube.com/watch?v=cR7d9_7yRrgמקור 1: https://he.wikipedia.org/…/%D7%92%D7%9F_%D7%94%D7%97%D7%99%…מקור 2: http://tel-aviv.millenium.org.il/…/9503E939-6A6E-4D3C-978D-…מקור לעובדת בונוס: https://he.wikipedia.org/…/%D7%94%D7%A1%D7%A4%D7%90%D7%A8%D…	גן החיות של תל אביב
32.6507,35.287797222	32.6507	35.287797222	האם המלך ליאונידס היה יהודי?בספר מקבים א' מתוארות בריתות שהמכבים כרתו עם רומא ועם ישות בשם אשפרטה (היא ספרטה).בפרק יב' כתוב: "וזה פתשגן האגרות אשר כתב יונתן אל בני אשפרטה (ספרטה): יונתן כהן גדול ומועצת זקני האומה והכוהנים ושאר עם היהודים לבני אשפרטה האחים שלום: עוד לפנים נשלחו אגרות אל חניה הכהן הגדול מאת אריס המולך בכם כי אחים אתם לנו כאשר יראה הפתשגן".הספרטנים ענו בתגובה: "אריס מלך בני אשפרטה לחניה כהן גדול שלום: נמצא בכתב על בני אשפרטה והיהודים כי אחים הם וכי הם מזרע אברהם:".כלומר, מלך הספרטנים אומר שהיהודים והספרטנים שניהם מזרע אברהם!במחקר, ספר מקבים א' נחשב די מדויק מבחינה היסטורית, ואכן המכבים כרתו ברית עם רומא באותה תקופה. (העובדה היא כמובן מה שכתוב בספר מקבים א', ולא שהספרטנים היו באמת יהודים, אבל נחמד להשתעשע ברעיון הזה).**עריכה** כמה הערות לאור התגובות: -העובדה היא אך ורק על כך שיש פרט שכתוב בספר מקבים א' (לכן המקור הוא הספר עצמו), התוכן של הפרט עצמו הוא לא עובדה. ציינתי את זה בסוגריים בסוף. -ברית עם רומא במהלך מרד החשמונאים זו גם עובדה. היא הובאה כי זה כתוב בפסוקים, וגם כדי להראות שזה לא מופרך שהייתה גם ברית והתכתבויות עם ספרטה. -בין 300 (תכלס זה היה 304) הספרטנים ומרד החשמונאים מפרידות 300 שנה בערך. -אין טענה שליאונידס היה יהודי. הוא לא היה יהודי, לא ישמעאלי ולא צאצא של שמשון הגיבור. זה סתם טיזר!!מקורות: ספר מקבים א' https://he.wikisource.org/…/%D7%A1%D7%A4%D7%A8_%D7%94%D7%9E…https://he.wikipedia.org/…/%D7%A1%D7%A4%D7%A8_%D7%9E%D7%A7%… http://www.ynet.co.il/articles/0,7340,L-4605855,00.html (אמנם יש מחקר של ד"ר אורי אמיתי בנושא, אבל אני בוחר פחות להסתמך עליו כי המקור האינטרנטי היחיד הוא YNET).	מזרע
32.333333333,34.85	32.333333333	34.85	על העניין של ערים תאומות כבר שמעתם? בטוח! ואם לא אז אני אספר בקצרה שאלו ערים שרחוקות אחת מהשנייה גאוגרפית ופוליטית ומטרתן ליצור קשר בין השתיים. הן נקראות ערים תאומות בגלל שבדר"כ (לא תמיד, אבל לרוב) הערים דומות מבחינה דמוגרפית. ערים תאומות נוהגות בין היתר לקיים חילופי סטודנטים ומשלחות. אך למרות שזאת עובדה מאוד לא חשובה- היא ידועה למדי ולכן היא לא העובדה המרכזית. אז... הידעתם שמיאמי (כן, כן... העיר האמריקאית שטופת השמש) היא עיר תאומה ללא אחרת מאשר... מוכנים לזה? אור עקיבא! הופתעתם? לא מפתיע. עובדה בונוס- העיר התאומה של אילת היא לוס אנג'לס ,של פתח תקווה היא שיקגו ושל נתניה היא לא אחרת מאשר יסוד המעלה (כן, גם אני הרמתי גבה). טוב נו, מי אמר שתאומים חייבים להיות זהים? *תייגו חבר שגר במיאמי וחבר שגר באור עקיבא ואל תגלו להם מי זה מי* מקורות: https://he.wikipedia.org/…/%D7%A2%D7%A8%D7%99%D7%9D_%D7%AA%… http://www.oraqiva.muni.il/about/Pages/twincities.aspx	נתניה
33.056111111,35.604166666	33.056111111	35.604166666	על העניין של ערים תאומות כבר שמעתם? בטוח! ואם לא אז אני אספר בקצרה שאלו ערים שרחוקות אחת מהשנייה גאוגרפית ופוליטית ומטרתן ליצור קשר בין השתיים. הן נקראות ערים תאומות בגלל שבדר"כ (לא תמיד, אבל לרוב) הערים דומות מבחינה דמוגרפית. ערים תאומות נוהגות בין היתר לקיים חילופי סטודנטים ומשלחות. אך למרות שזאת עובדה מאוד לא חשובה- היא ידועה למדי ולכן היא לא העובדה המרכזית. אז... הידעתם שמיאמי (כן, כן... העיר האמריקאית שטופת השמש) היא עיר תאומה ללא אחרת מאשר... מוכנים לזה? אור עקיבא! הופתעתם? לא מפתיע. עובדה בונוס- העיר התאומה של אילת היא לוס אנג'לס ,של פתח תקווה היא שיקגו ושל נתניה היא לא אחרת מאשר יסוד המעלה (כן, גם אני הרמתי גבה). טוב נו, מי אמר שתאומים חייבים להיות זהים? *תייגו חבר שגר במיאמי וחבר שגר באור עקיבא ואל תגלו להם מי זה מי* מקורות: https://he.wikipedia.org/…/%D7%A2%D7%A8%D7%99%D7%9D_%D7%AA%… http://www.oraqiva.muni.il/about/Pages/twincities.aspx	יסוד המעלה
32.9925,35.690555555	32.9925	35.690555555	האם הכרתם את אחיכם במזרח הרחוק? בני המנשה הם חלק מבני השבטים קוקי-צ'ין-מיזו ממדינות מיזוראם, אסאם ומניפור שבצפון מזרח הודו על גבול מיאנמר, המזהים עצמם כיהודים.על פי המסורת המועברת בין הדורות בני שבטים אלו הם צאצאי שבט מנשה, מעשרת השבטים שגלו מארץ ישראל בסוף תקופת בית ראשון במאה ה-8 לפנה"ס. מספרם של אלו המקיימים זיקה ליהדות ולעם ישראל נאמד ב-7,000 נפש.לפי הכתוב בתנ"ך, לאחר כיבוש ממלכת ישראל על ידי ממלכת אשור בשנת 722 לפנה"ס, הוגלו עשרת השבטים מהארץ. על פי המסורת הנקוטה בידם, בני שבט מנשה נדדו מזרחה לכיוון אפגניסטן והגיעו עד לסין. בהיותם בסין, במהלך המאה ה-3 נהגו בהם באכזריות, כפו עליהם עבדות והם גורשו מהאזור. כאשר יצאו מסין, אבד או נגזל מהם "הספר הקדוש", ספר התורה שהיה מצוי בידם. במסורות ושירים עתיקי יומין, הם שרים על ה"כלב" או המלך הרשע שגזל מהם את הספר הקדוש. מתקופה זו ואילך המסורת הועברה בעל פה. בהמשך הם הגיעו לאזור הררי בשולי הרי ההימלאיה, שם השתדלו לשמור על מורשתם. לבסוף הגיעו למקומם הנוכחי, מדינות מיזוראם ומניפור שבצפון מזרח הודו.בני מנשה מקיימים מנהגים רבים ומצוות מהיהדות, ביניהם שמירת השבת, ברית מילה, חגי ומועדי ישראל ועוד. בעשור האחרון היו כמה גלי עלייה קטנים של בני מנשה שהתמקמו בצפון הארץ: כרמיאל, קצרין ופרדס חנה והיד כאמור עוד נטויה...מקור: https://he.wikipedia.org/…/%D7%91%D7%A0%D7%99_%D7%9E%D7%A0%…	קצרין
29.55,34.95	29.55	34.95	מאגורות "נחש צמא" (מחפורות צינים)מובילות לשומקום, והן סיפור הרפתקת נפט כושלת.בתחילת שנות ה- 70 נבדקה האפשרות להקים מאגרי נפט תת-קרקעיים לשעת חירום. בהעדר ניסיון ישראלי, הובאו לארץ מומחים מצרפת ומשוודיה. הם המליצו לחפור מאגרים בשטח גרניט וגיר יבש, כלומר באזור אילת. הסלע עבר בדיקות מעבדה ונמצא מתאים. אבל לסדקים האורכיים שבו לא כל כך שמו לב.לאחר מלחמת יום הכיפורים התחילו העבודות. נחפרו שתי מנהרות באורך 400 ו-200 מטר שגם ג'יפ יכול להיכנס בהן. אבל הנפט חילחל וברח. פעמיים ברח. גם לאחר שמומחה שוודי יעץ לצפות את המנהרות בחומר אטימה. בלית ברירה, ננטשו מערות נחש צמא. לא לגמרי ננטשו. למרות שפתח הימנית נסתם במפולת, למרות שלט האזהרה, מטיילים באים לשמאלית. מקצתםנשארים שם למסיבות עד קצה הלילה, עם שחר צופים בזריחה על בקעת נחל צין.מנהרות נחש צמא, על שם "מעלה נחש צמא", חצובות בתחתית ההר. כעשרה מטרים גובהן. על הכניסה אתה מבחין באותם סדקי תקרה שדנו לפיאסקו את אגירת הנפט. בדפנות שרידי כבלים חשמליים, קרסים חלודים שתמכו כנראה בצינורות האוויר.במערה שמשמאל, החסומה. את משקופי הברזל בכניסה ניקב משהו גדול מכדורים. אומרים שבמלחמת המפרץ היה פה גיהינום קטן. חיל האוויר תרגל ירי אל מחסני הטילים של סדאם.ישנם כמה קונספירציות,יש הטוענים שהמנהרות נחפרו לצורך איכסון נשק אטומי. ויש הטוענים שזהו בכלל מקלט אטומי ממשלתי.מקור http://www.nrg.co.il/online/1/ART2/234/261.htmlוהדמות שרואים בתמונה , זה אני.	אילת
31.777946,35.245686	31.777946	35.245686	מנחם בגין, אשר הספיק רבות ב-78 שנות חייו (ראש הממשלה השישי של ישראל, יו"ר תנועת החרות ומפלגת הליכוד, שר בממשלות ישראל, מפקד האצ"ל בתקופת המאבק במנדט הבריטי, חותם הסכם השלום בין ישראל למצרים, וחתן פרס נובל לשלום לשנת 1978), ביקש בצוואתו "הלוויה צנועה, פשוטה ויהודית" ללא שום גינוני כבוד והספדים - וכך קיבל. כשנפטרה אשתו עליזה הוא בחר לקבור אותה לצד אסירי המחתרות מאיר פיינשטיין ומשה ברזני בהר הזיתים ולאחר מותו נקבר לצדה ולידם לבקשתו ולא בחלקת גדולי האומה. מצבתו מינימליסטית ביותר - מופיעים עליה שמו העברי, שנות חייו ותו לא. עובדת בונוס: בגין אינו ראש הממשלה היחיד (שנפטר) שלא נקבר בחלקת גדולי האומה - בן גוריון בשדה בוקר ואריאל שרון נקבר לצד אשתו לילי בחוות השקמים (בניגוד לחוק הקבורה).מקור: https://he.wikipedia.org/…/%D7%9E%D7%A0%D7%97%D7%9D_%D7%91%… https://www.youtube.com/watch?v=2leApGjVcU4 http://mountofolives.co.il/…/%D7%9E%D7%A0%D7%97%D7%9D-%D7%…/	הר הזיתים
32.39184722,34.93	32.39184722	34.93	מה עולה לכם בראש כשאתם רואים שם של מקום ולצידו הכינוי ״איחוד״ או ״מאוחד״? הנטייה הטבעית היא לחשוב שמדובר ב-2 קבוצות יריבות שהחליטו לאחד כוחות, אבל ממש כמו 2 דוכני שווארמה האחד ליד השני שנושאים באותו השם לצד ״המקורי״ ו״האורגינל״ מדובר על פילוג כואב. גבעת חיים איחוד <-> גבעת חיים מאוחד אשדות יעקב איחוד <-> אשדות יעקב מאוחד עין חרוד איחוד <-> עין חרוד מאוחד 6 קיבוצים שנוצרו מ-3 קיבוצים שהתפצלו בעקבות הפילוג בקיבוץ המאוחד, כתוצאה ממשבר אידאולוגי חריף. חצי מהקיבוצים ב״איחוד הקיבוצים״ וחצי ב״קיבוץ המאוחד״ (שגם אלה שמות אירוניים משהו) מקור: https://he.wikipedia.org/…/%D7%94%D7%A4%D7%99%D7%9C%D7%95%D…	גבעת חיים מאוחד
32.39808056,34.93180278	32.39808056	34.93180278	מה עולה לכם בראש כשאתם רואים שם של מקום ולצידו הכינוי ״איחוד״ או ״מאוחד״? הנטייה הטבעית היא לחשוב שמדובר ב-2 קבוצות יריבות שהחליטו לאחד כוחות, אבל ממש כמו 2 דוכני שווארמה האחד ליד השני שנושאים באותו השם לצד ״המקורי״ ו״האורגינל״ מדובר על פילוג כואב. גבעת חיים איחוד <-> גבעת חיים מאוחד אשדות יעקב איחוד <-> אשדות יעקב מאוחד עין חרוד איחוד <-> עין חרוד מאוחד 6 קיבוצים שנוצרו מ-3 קיבוצים שהתפצלו בעקבות הפילוג בקיבוץ המאוחד, כתוצאה ממשבר אידאולוגי חריף. חצי מהקיבוצים ב״איחוד הקיבוצים״ וחצי ב״קיבוץ המאוחד״ (שגם אלה שמות אירוניים משהו) מקור: https://he.wikipedia.org/…/%D7%94%D7%A4%D7%99%D7%9C%D7%95%D…	גבעת חיים איחוד
32.083333333,34.816666666	32.083333333	34.816666666	לכבוד הופעת הבכורה של רד בול לייפציג הגרמנית בליגת האלופות אמש, קבלו עובדה מעניינת על האצטדיון (המהמם) שלה - 'רד בול ארנה'. כאשר עיריית לייפציג החליטה, לקראת סוף המילניום הקודם, שהאצטדיון העצום שלה - 'צנטרלשטדיון' (Zentralstadion) שהכיל כ 100 אלף מקומות (תמונה 1), סיים את חלקו ההיסטורי ושהגיע הזמן להקים בעיר אצטדיון גדול ומודרני, היא לא הייתה צריכה לחפש שטח פנוי להקמת האצטדיון, אלא פשוט הקימה אותו בתוך האצטדיון הישן, ומבלי להרוס את האצטדיון הישן. איך זה אפשרי? צנטרלשדיון המיתולוגי היה מגרש מזרח אירופאי טיפוסי - יציעים נמוכים וארוכים, רחוקים מהדשא ומתפרסים על שטח רב. וסרמיל או רמת גן בענק, אם תרצו. האצטדיון החדש - 'רד בול ארנה' (תמונה 2) הוקם בצורה מודרנית וחסכונית במקום על ידי בנייה של יציעים גבוהים ותלולים אשר צמודים לדשא. אמנם האצטדיון קטן מקודמו, מכיל רק כ 43,000 מקומות ישיבה, אך נמצא כולו בתוך שטחו של האצטדיון הישן. והיציעים הישנים, מה איתם? הם כיום מכוסים בדשא ירוק, מקיפים את האצטדיון החדש ומתוכם יוצאים גשרים המובילים אל תוך היציעים החדשים. עובדת בונוס: באיטליה בוצע ניסיון דומה באצטדיונה של קליארי - Stadio Sant'Elia (תמונה 3). יש שיגידו שהתוצאות מצביעות על הרבה מההבדלים בין הגרמנים לאיטלקים :)מקור: https://he.wikipedia.org/…/%D7%A8%D7%93_%D7%91%D7%95%D7%9C_… מקור בונוס: https://en.wikipedia.org/wiki/Stadio_Sant%27Elia	רמת גן
33.278888888,35.576666666	33.278888888	35.576666666	את סדרת הטלויזיה "מסע הפלאים של נילס הולגרסון" כמעט שאין מי שלא מכיר, ואולי חלקיכם גם קראתם את ספרה של הסופרת השוודית סלמה לגרלף, שעליו התבססה הסדרה. אך רבים מאלה שגדלו על הסדרה אינם יודעים שאי-שם בשנות ה-60, העיתון אצבעוני פרסם גרסה משלו לעלילותיו של נילס, בה קיבל הגיבור את השם "גיל" והמסע שלו עם האווזים התקיים בארץ ישראל ממטולה ועד לאילת. יחי ההבדל הקטן.עובדת בונוס: סלמה לגרלף כתבה במקור את הספר עבור תוכנית לימודי הגיאוגרפיה של בתי הספר היסודיים של שוודיה.תייגו חבר שהוא אקה וחבר שהוא גוסטב ואל תגלו להם מי זה מי. ;-)מקורות: https://he.wikipedia.org/…/%D7%9E%D7%A1%D7%A2_%D7%94%D7%A4%… http://blog.nli.org.il/%D7%9E%D7%9E%D7%98%D7%95%D7%9C%D7%9…/	מטולה
29.55,34.95	29.55	34.95	את סדרת הטלויזיה "מסע הפלאים של נילס הולגרסון" כמעט שאין מי שלא מכיר, ואולי חלקיכם גם קראתם את ספרה של הסופרת השוודית סלמה לגרלף, שעליו התבססה הסדרה. אך רבים מאלה שגדלו על הסדרה אינם יודעים שאי-שם בשנות ה-60, העיתון אצבעוני פרסם גרסה משלו לעלילותיו של נילס, בה קיבל הגיבור את השם "גיל" והמסע שלו עם האווזים התקיים בארץ ישראל ממטולה ועד לאילת. יחי ההבדל הקטן.עובדת בונוס: סלמה לגרלף כתבה במקור את הספר עבור תוכנית לימודי הגיאוגרפיה של בתי הספר היסודיים של שוודיה.תייגו חבר שהוא אקה וחבר שהוא גוסטב ואל תגלו להם מי זה מי. ;-)מקורות: https://he.wikipedia.org/…/%D7%9E%D7%A1%D7%A2_%D7%94%D7%A4%… http://blog.nli.org.il/%D7%9E%D7%9E%D7%98%D7%95%D7%9C%D7%9…/	אילת
